,global_unique_identifier,last_edited_date,taxonomic_order,category,common_name,scientific_name,subspecies_common_name,subspecies_scientific_name,observation_count,breeding_bird_atlas_code,breeding_bird_atlas_category,age_sex,country,country_code,state,state_code,county,county_code,iba_code,bcr_code,usfws_code,atlas_block,locality,locality_id,locality_type,latitude,longitude,observation_date,time_observations_started,observer_id,sampling_event_identifier,protocol_type,protocol_code,project_code,duration_minutes,effort_distance_km,effort_area_ha,number_observers,all_species_reported,group_identifier,has_media,approved,reviewed,reason,trip_comments,species_comments,v47,pelagic,legit,duplicate527,URN:CornellLabOfOrnithology:EBIRD:OBS116347226,20:48.0,1950,species,Eurasian Collared-Dove,Streptopelia decaocto,,,1,,,,United States,US,California,US-CA,Del Norte,US-CA-015,,NA,,,2011-04-22-offshoresurvey-leg7,L1148045,P,41.657985,-125.04615,2011-04-22,8:20:00,obsr18326,S8122120,Traveling,P22,EBIRD,20,12.07,NA,4,1,G253449,0,1,0,,"second full day offshore, quite slow overall especially compared to the first day, though early on there were plenty of Leach's, no pterodromas, I had two groups of Parakeet Auklets that no one else was able to get on, 2 EUCD landed on the ship, 2 Fin Whales. repositioning cruise bulk upload of 20-min surveys, location plotted is midpoint of transect",joined the first with both flying around and landing on the ship!,NA,TRUE,1,1520,URN:CornellLabOfOrnithology:EBIRD:OBS319526557,51:45.0,1950,species,Eurasian Collared-Dove,Streptopelia decaocto,,,1,,,,United States,US,Washington,US-WA,Clallam,US-WA-009,US-WA_3348,NA,,,Pacific Ocean off Clallam County,L3642369,P,47.9712935,-125.0962114,2015-05-08,,obsr23008,S23437069,Historical,P62,EBIRD,NA,NA,NA,20,1,,0,1,0,,Birds seen from MV Noordam,,NA,TRUE,1,1515,URN:CornellLabOfOrnithology:EBIRD:OBS398630817,16:26.0,1950,species,Eurasian Collared-Dove,Streptopelia decaocto,,,7,,,,United States,US,Oregon,US-OR,Curry,US-OR-015,,NA,,,"42.4x-124.965 - May 5, 2016 12:29 PM",L4565054,P,42.4003773,-124.9651162,2016-05-03,11:30:00,obsr296388,S29423398,eBird Pelagic Protocol,P60,EBIRD,32,15.289,NA,1,1,,0,1,0,,Birding from the Norwegian Pearl.Â <br />Submitted from eBird Android 1.0.4,,NA,TRUE,1,1474,URN:CornellLabOfOrnithology:EBIRD:OBS400403501,05:32.0,1950,species,Eurasian Collared-Dove,Streptopelia decaocto,,,1,,,,United States,US,California,US-CA,San Francisco,US-CA-075,US-CA_4680,NA,,,Offshore--continental shelf waters (southern SF Co.),L2365653,H,37.5148275,-122.8446579,2016-05-03,12:30:00,obsr323293,S29523888,Traveling,P22,EBIRD,150,32.187,NA,2,1,,0,1,0,,"Wings birding tour on cruise ship San Diego to Vancouver, BC.",,NA,TRUE,1,1531,URN:CornellLabOfOrnithology:EBIRD:OBS398817166,47:39.0,1950,species,Eurasian Collared-Dove,Streptopelia decaocto,,,1,,,,United States,US,California,US-CA,Monterey,US-CA-053,,NA,,,"35.7941x-122.1718 - May 4, 2016, 5:57 AM",L4566883,P,35.794081,-122.171814,2016-05-04,5:57:00,obsr19105,S29435091,Traveling,P22,EBIRD,32,16.093,NA,11,1,G1740074,0,1,1,,"<br />Submitted from eBird for iOS, version 1.1.6 Build 45",Photo,NA,TRUE,1,1865,URN:CornellLabOfOrnithology:EBIRD:OBS398850644,38:19.0,1950,species,Eurasian Collared-Dove,Streptopelia decaocto,,,1,,,,United States,US,California,US-CA,Sonoma,US-CA-097,,NA,,,"38.2723x-124.0544 - May 4, 2016, 2:57 PM",L4567161,P,38.272293,-124.054433,2016-05-04,14:57:00,obsr19105,S29437143,Traveling,P22,EBIRD,30,16.093,NA,15,1,G1740100,0,1,0,,"<br />Submitted from eBird for iOS, version 1.1.6 Build 45","Still present; found on board at dawn in Monterey County, riding the boat.",NA,TRUE,1,1528,URN:CornellLabOfOrnithology:EBIRD:OBS406917854,10:21.0,1950,species,Eurasian Collared-Dove,Streptopelia decaocto,,,3,,,,United States,US,California,US-CA,Humboldt,US-CA-023,,NA,,,Offshore California Hour 2 of 3,L4637450,P,41.34044,-125.47451,2016-05-12,7:00:00,obsr131591,S29890053,eBird Pelagic Protocol,P60,EBIRD,60,39.429,NA,2,1,G1783562,0,1,0,,"Princess Cruise San Francisco to Alaska round trip, Day 2 northbound. Wind SW 6 kt; Overcast, Air temp 55F; SST 53.6F; Swell 3-5 ft NW.  Paul Lehman (with 9-person Wings tour group) and Bruce Rideout observers. MUPE seen first by Paul Lehman, then by Bruce Rideout and others in the group. An all-dark petrel with long narrow wings cocked forward at the carpi, long glides and steep arcs. Although they can have pale primary bases below, I could not discern any paleness on the underwing. The time was 07:35 and the coordinates 41.52209, -125.58444.",,NA,TRUE,1,1516,URN:CornellLabOfOrnithology:EBIRD:OBS402235865,08:46.0,1950,species,Eurasian Collared-Dove,Streptopelia decaocto,,,2,,,,United States,US,Oregon,US-OR,Curry,US-OR-015,,NA,,,offshore Curry,L4593863,P,41.845,-125.8,2016-05-12,8:00:00,obsr50748,S29624639,Traveling,P22,EBIRD,30,16.093,NA,11,0,,0,1,0,,"123-138 km off Curry Co., from Grand Princess cruise ship",,NA,TRUE,1,1866,URN:CornellLabOfOrnithology:EBIRD:OBS406917859,32:14.0,1950,species,Eurasian Collared-Dove,Streptopelia decaocto,,,3,,,,United States,US,Oregon,US-OR,Coos,US-OR-011,,NA,,,Offshore Oregon Hour 8 of 10,L4637452,P,44.02748,-127.14801,2016-05-12,15:20:00,obsr131591,S29890054,eBird Pelagic Protocol,P60,EBIRD,60,40.234,NA,2,1,G1783552,0,1,0,,"Princess Cruise San Francisco to Alaska round trip, Day 2 northbound. Wind SW 6 kt; Overcast, Air temp 55F; SST 53.6F; Swell 3-5 ft NW.  Paul Lehman (with 9-person Wings tour group) and Bruce Rideout observers. The three Eurasian Collared-Doves were the same individuals seen earlier in the day. They presumably got on board in San Francisco and will stay with the ship at least until our first port, Juneau.",,NA,TRUE,1,1524,URN:CornellLabOfOrnithology:EBIRD:OBS406923741,31:15.0,1950,species,Eurasian Collared-Dove,Streptopelia decaocto,,,2,,,,Canada,CA,British Columbia,CA-BC,Mount Waddington,CA-BC-MW,,NA,,,Offshore British Columbia Hour 4 of 14,L4637519,P,49.75687,-130.8548,2016-05-13,9:00:00,obsr131591,S29890460,eBird Pelagic Protocol,P60,EBIRD,60,38.624,NA,2,1,G1783543,0,1,0,,"Princess Cruise San Francisco to Alaska round trip Day 3 northbound. Overcast until clearing mid-afternoon. Air temp 50-60F; SST 55.4F; Swell NW 1-3 ft.; Wind 7-10 kt SW, dropping later in the day. Paul Lehman (with 9-person Wings tour group) and Bruce Rideout observers.",,NA,TRUE,1,1483,URN:CornellLabOfOrnithology:EBIRD:OBS505204980,03:35.0,1950,species,Eurasian Collared-Dove,Streptopelia decaocto,,,2,,,,United States,US,California,US-CA,San Mateo,US-CA-081,,NA,,,Offshore CA,L5893393,P,37.0716667,-123.125,2017-05-11,10:00:00,obsr193047,S37186868,Traveling,P22,EBIRD,60,34.44,NA,1,1,,0,1,0,,,Continuing birds flying with and landing on the ship,NA,TRUE,1,1476,URN:CornellLabOfOrnithology:EBIRD:OBS505209338,10:59.0,1950,species,Eurasian Collared-Dove,Streptopelia decaocto,,,2,,,,United States,US,California,US-CA,San Francisco,US-CA-075,,NA,,,Offshore CA,L5893471,P,37.335,-123.33,2017-05-11,11:00:00,obsr193047,S37187104,Traveling,P22,EBIRD,30,17.703,NA,1,1,,0,1,0,,,Continuing birds flying with ship,NA,TRUE,1,1533,URN:CornellLabOfOrnithology:EBIRD:OBS510101830,55:31.0,1950,species,Eurasian Collared-Dove,Streptopelia decaocto,,,1,,,,United States,US,California,US-CA,Orange,US-CA-059,US-CA_4685,NA,,,Lausen Sea Mount,L5803436,H,33.3974106,-118.0006099,2017-06-10,9:30:00,obsr158843,S37519618,Traveling,P22,EBIRD,90,12.875,NA,46,1,G2485531,0,1,0,,"San Bernardino Valley Audubon pelagic trip out of Dana Point aboard the Ocean Institute's R/V Sea Explorer, with Mike Bursk as Captain and Tom Benson, Jon Feenstra, Matt Grube, Robert McNab, and Brad Singer as leaders. From Dana Point Harbor, we traveled west to Lausen Sea Mount, north-northwest to Platforms Eureka, Ellen, and Edith, east and south to San Gabriel Canyon, east toward Laguna Beach, and finally southeast along the 100-fathom curve back to Dana Point Harbor, with minor variations in course for birds and ocean conditions. Weather was mostly cloudy but becoming partly cloudy midday, with light to moderate winds, and temperatures in the 60s (F). This checklist covers the area from Lausen Sea Mount to the halfway point to Platform Eureka, and includes several one mile transects along a chum and oil slick that we laid out over the sea mount.----<a href=""https://www.flickr.com/photos/40928097@N07/34484869073/in/dateposted-public/"" title=""Pelagic trip track - 10 Jun 2017""><img src=""https://c1.staticflickr.com/5/4278/34484869073_e106e2f848_z.jpg"" alt=""Pelagic trip track - 10 Jun 2017"" /></a>",Continuing bird that landed on the boat; it departed when we were about halfway from the sea mount to the oil platforms.,NA,TRUE,1,1869,URN:CornellLabOfOrnithology:EBIRD:OBS606114214,32:19.0,1950,species,Eurasian Collared-Dove,Streptopelia decaocto,,,1,,,,United States,US,Oregon,US-OR,Lane,US-OR-039,,NA,,,"North Pacific Ocean (44.0369,-125.2201)",L7290111,P,44.036917,-125.220114,2018-04-26,6:34:00,obsr19105,S44987406,Traveling,P22,EBIRD,17,11.843,NA,8,1,G3134619,0,1,0,,,,NA,TRUE,1,1870,URN:CornellLabOfOrnithology:EBIRD:OBS606112574,27:40.0,1950,species,Eurasian Collared-Dove,Streptopelia decaocto,,,1,,,,United States,US,Oregon,US-OR,Lincoln,US-OR-041,,NA,,,"North Pacific Ocean (44.3365,-125.2271)",L7290102,P,44.336514,-125.227095,2018-04-26,7:22:00,obsr19105,S44987314,eBird Pelagic Protocol,P60,EBIRD,16,10.715,NA,15,1,G3134633,0,1,0,,,,NA,TRUE,1,1872,URN:CornellLabOfOrnithology:EBIRD:OBS606112251,54:38.0,1950,species,Eurasian Collared-Dove,Streptopelia decaocto,,,2,,,,United States,US,Oregon,US-OR,Lincoln,US-OR-041,,NA,,,"North Pacific Ocean (44.4408,-125.2294)",L7290099,P,44.440753,-125.229407,2018-04-26,7:39:00,obsr19105,S44987292,Traveling,P22,EBIRD,16,11.44,NA,15,1,G3134636,0,1,0,,,,NA,TRUE,1,1871,URN:CornellLabOfOrnithology:EBIRD:OBS626109071,06:19.0,1950,species,Eurasian Collared-Dove,Streptopelia decaocto,,,1,,,,United States,US,Oregon,US-OR,Lincoln,US-OR-041,,NA,,,"North Pacific Ocean (44.5464,-125.2313)",L7290093,P,44.546384,-125.231332,2018-04-26,7:57:00,obsr335210,S45026234,eBird Pelagic Protocol,P60,EBIRD,14,9.888,NA,15,1,G3134643,1,1,0,,,,NA,TRUE,1,1875,URN:CornellLabOfOrnithology:EBIRD:OBS606101177,54:46.0,1950,species,Eurasian Collared-Dove,Streptopelia decaocto,,,4,,,,United States,US,Washington,US-WA,Grays Harbor,US-WA-027,,NA,,,"North Pacific Ocean (47.1309,-125.2892)",L7289951,P,47.130934,-125.289178,2018-04-26,15:42:00,obsr19105,S44986533,eBird Pelagic Protocol,P60,EBIRD,22,13.386,NA,13,1,G3134683,0,1,0,,,,NA,TRUE,1,1867,URN:CornellLabOfOrnithology:EBIRD:OBS613853975,35:53.0,1950,species,Eurasian Collared-Dove,Streptopelia decaocto,,,5,,,,United States,US,Oregon,US-OR,Coos,US-OR-011,,NA,,,Cruise Ship 05032018 #7,L7371431,P,43.69835,-125.8255833,2018-05-03,15:15:00,obsr230086,S45447395,eBird Pelagic Protocol,P60,EBIRD,105,56.327,NA,2,1,G3176081,0,1,0,,"Birding with David Sonneborn aboard Nieuw Amsterdam.  Conditions: seas calm, light breeze (Beaufort 2), visibility unlimited.  Observations from deck 3 forward.",Later 8 found roosting on upper deck.,NA,TRUE,1,15,URN:CornellLabOfOrnithology:EBIRD:OBS622030424,14:50.0,1950,species,Eurasian Collared-Dove,Streptopelia decaocto,,,1,,,,Canada,CA,British Columbia,CA-BC,Central Coast,CA-BC-CC,,NA,,,Queen Charlotte Sound,L2357800,H,51.6111946,-129.4793701,2018-05-08,,obsr636717,S45921032,Incidental,P20,EBIRD,NA,NA,NA,NA,0,,0,1,0,,,"seen from a cruiseship, probably ship assisted",NA,TRUE,1,1529,URN:CornellLabOfOrnithology:EBIRD:OBS53757512,28:21.0,1950,species,Eurasian Collared-Dove,Streptopelia decaocto,,,1,,,,United States,US,California,US-CA,Los Angeles,US-CA-037,,NA,,,Cortes Bank (LA Co.),L526621,H,32.4170663,-119.1082764,2008-05-11,6:00:00,obsr29050,S3857913,Traveling,P22,EBIRD,840,48.279,NA,36,1,G195518,0,1,0,,SoCalBirding pelagic trip - San Diego to Cortez/Tanner Banks. Some of these birds were (also) recorded in Ventura County.,,NA,TRUE,1,863,URN:CornellLabOfOrnithology:EBIRD:OBS91194291,40:12.0,1950,species,Eurasian Collared-Dove,Streptopelia decaocto,,,1,,,,United States,US,California,US-CA,Santa Barbara,US-CA-083,US-CA_4690,NA,,,Offshore--southwest of Pt. Conception (SBA Co.),L668885,H,34.2004448,-120.6188965,2010-05-01,9:35:00,obsr29050,S6363119,Traveling,P22,EBIRD,165,24.14,NA,60,1,G165717,0,1,0,,LAAS pelagic aboard Condor Express. Transit from Pt Conception west. Rough and windy.,,NA,TRUE,1,526,URN:CornellLabOfOrnithology:EBIRD:OBS116347216,06:51.0,1950,species,Eurasian Collared-Dove,Streptopelia decaocto,,,1,,,,United States,US,California,US-CA,Del Norte,US-CA-015,,NA,,,2011-04-22-offshoresurvey-leg6,L1148044,P,41.55639,-125.039625,2011-04-22,8:00:00,obsr18326,S8122119,Traveling,P22,EBIRD,20,12.07,NA,4,1,G253450,1,1,0,,"second full day offshore, quite slow overall especially compared to the first day, though early on there were plenty of Leach's, no pterodromas, I had two groups of Parakeet Auklets that no one else was able to get on, 2 EUCD landed on the ship, 2 Fin Whales. repositioning cruise bulk upload of 20-min surveys, location plotted is midpoint of transect",waypoint 227,NA,TRUE,1,487,URN:CornellLabOfOrnithology:EBIRD:OBS237511584,43:31.0,1950,species,Eurasian Collared-Dove,Streptopelia decaocto,,,1,,,,United States,US,California,US-CA,Santa Barbara,US-CA-083,,NA,,,Offshore--Point Conception I,L2686469,P,34.6241678,-120.7342529,2011-05-03,7:40:00,obsr221434,S17247050,Stationary,P21,EBIRD,110,NA,NA,1,1,,0,1,0,,"Clear skies, NE wind 15MPH",,NA,TRUE,1,518,URN:CornellLabOfOrnithology:EBIRD:OBS118759574,11:18.0,1950,species,Eurasian Collared-Dove,Streptopelia decaocto,,,1,,,,United States,US,Oregon,US-OR,Lincoln,US-OR-041,,NA,,,Offshore survey - transect 53,L1167816,P,44.43939,-125.1684,2011-05-11,15:20:00,obsr267011,S8261825,Traveling,P22,EBIRD,20,11.265,NA,1,1,,0,1,0,,"Observations made from MS Amsterdam on cruise from San Diego, CA to Vancouver, BC.",,NA,TRUE,1,481,URN:CornellLabOfOrnithology:EBIRD:OBS119020653,00:35.0,1950,species,Eurasian Collared-Dove,Streptopelia decaocto,,,1,,,,United States,US,California,US-CA,San Luis Obispo,US-CA-079,,NA,,,CA Offshore,L1170026,P,35.0503056,-121.6747778,2011-05-14,9:00:00,obsr230086,S8277008,Traveling,P22,EBIRD,60,33.795,NA,1,1,,0,1,0,,,,NA,TRUE,1,53,URN:CornellLabOfOrnithology:EBIRD:OBS125625771,46:08.0,1950,species,Eurasian Collared-Dove,Streptopelia decaocto,,,1,,,,United States,US,California,US-CA,Mendocino,US-CA-045,,NA,,,SEA-S236-IO-013,L1268531,P,39.338,-125.137,2011-07-26,7:00:00,obsr58678,S8770389,Incidental,P20,EBIRD,NA,NA,NA,1,0,,0,1,0,,"Approximately 60 nm (70 statute miles) W of Mendocino Bay, CA.","First noticed by Chang sometime in the dawn watch, so it likely found us even further west.  Stayed perched on the shrouds for much of the day.  I got good looks at it, leaving no question about the ID.",NA,TRUE,1,534,URN:CornellLabOfOrnithology:EBIRD:OBS124692356,17:46.0,1950,species,Eurasian Collared-Dove,Streptopelia decaocto,,,1,,,,United States,US,California,US-CA,San Diego,US-CA-073,,NA,,,Thirty Mile Bank (SD Co.),L717370,H,32.6440004,-117.7281189,2011-08-15,11:20:00,obsr29050,S8708755,Traveling,P22,EBIRD,135,32.187,NA,40,1,G290273,0,1,0,,"BVAS pelagic trip aboard Grande. Transit over the Thirty Mile Bank from halfway across the San Diego Trough west to the LA County line. Seas about 1m, wind about 5 knots. Overcast skies.",,NA,TRUE,1,9,URN:CornellLabOfOrnithology:EBIRD:OBS218809087,10:48.0,1950,species,Eurasian Collared-Dove,Streptopelia decaocto,,,1,,,,Canada,CA,British Columbia,CA-BC,Kitimat-Stikine,CA-BC-KS,,NA,,,Can- BC- Hecate Strait,L2434067,P,52.2143386,-130.0341797,2012-05-19,7:20:00,obsr21114,S15757111,Incidental,P20,EBIRD,NA,NA,NA,1,1,,0,1,0,,,,NA,TRUE,1,523,URN:CornellLabOfOrnithology:EBIRD:OBS459674028,44:32.0,1950,species,Eurasian Collared-Dove,Streptopelia decaocto,,,X,,,,United States,US,Washington,US-WA,Grays Harbor,US-WA-027,,NA,,,Offshore Washington Coast - Between Quinalt and Gray's Canyon,L5374366,P,47.1358,-125.4263,2012-07-11,,obsr333350,S33876489,Historical,P62,EBIRD,NA,24.14,NA,2,1,,0,1,0,,"Birding while on the R/V Thompson in July 2012, travelling off the shelf between Quinalt and Grays canyons. Birds seen at multiple locations in areas offshore the WA coast around the shelf and shelf break where research was taking place. I did not record the exact locations of bird sightings.",On the boat!,NA,TRUE,1,54,URN:CornellLabOfOrnithology:EBIRD:OBS583159670,41:48.0,1950,species,Eurasian Collared-Dove,Streptopelia decaocto,,,X,,,,United States,US,California,US-CA,San Diego,US-CA-073,,NA,,,Off Pt. Loma (offshore species only),L717362,H,32.6219112,-117.2666931,2013-02-25,10:00:00,obsr567508,S43265359,Traveling,P22,EBIRD,240,48.28,NA,2,0,,0,1,0,,whale watch.  With Christen Foehring,,NA,TRUE,1,525,URN:CornellLabOfOrnithology:EBIRD:OBS210899381,40:19.0,1950,species,Eurasian Collared-Dove,Streptopelia decaocto,,,1,,,,Canada,CA,British Columbia,CA-BC,Sunshine Coast,CA-BC-SC,,NA,,,Horseshoe Bay-Nanaimo ferry,L339319,H,49.2866192,-123.5896683,2013-09-14,7:00:00,obsr113983,S15174429,Traveling,P22,EBIRD,60,32.187,NA,4,1,G695842,0,1,0,,"With Rob Lyske, Colin Clasen, Tanya Patzke",flying around and landing on the ferry,NA,TRUE,1,512,URN:CornellLabOfOrnithology:EBIRD:OBS257040505,25:27.0,1950,species,Eurasian Collared-Dove,Streptopelia decaocto,,,3,,,,United States,US,Oregon,US-OR,Curry,US-OR-015,,NA,,,Offshore survey - transect 53,L2885480,P,42.034729,-125.07453,2014-05-01,9:40:00,obsr267011,S18600946,Traveling,P22,EBIRD,20,11.265,NA,15,1,,0,1,0,,"Observations made from MS Westerdam on cruise from San Diego, CA to Vancouver, BC.",,NA,TRUE,1,519,URN:CornellLabOfOrnithology:EBIRD:OBS256542683,15:29.0,1950,species,Eurasian Collared-Dove,Streptopelia decaocto,,,1,,,,United States,US,Washington,US-WA,Clallam,US-WA-009,,NA,,,Offshore survey - transect 81,L2879385,P,48.473372,-124.764378,2014-05-02,7:10:00,obsr267011,S18564081,Traveling,P22,EBIRD,20,9.656,NA,15,1,,0,1,0,,"Observations made from MS Westerdam on cruise from San Diego, CA to Vancouver, BC.",,NA,TRUE,1,513,URN:CornellLabOfOrnithology:EBIRD:OBS261730520,27:25.0,1950,species,Eurasian Collared-Dove,Streptopelia decaocto,,,1,,,,United States,US,Oregon,US-OR,Curry,US-OR-015,,NA,,,Oregon Offshore Waters,L2949729,P,42.72496,-125.11979,2014-06-02,11:30:00,obsr131591,S18945212,eBird Pelagic Protocol,P60,EBIRD,60,41.682,NA,2,1,,0,1,0,,Paul Lehman and Bruce Rideout observers,Found on the wires above the upper deck of the ship (Star Princess),NA,TRUE,1,873,URN:CornellLabOfOrnithology:EBIRD:OBS317666026,33:24.0,1950,species,Eurasian Collared-Dove,Streptopelia decaocto,,,1,,,,United States,US,Washington,US-WA,Clallam,US-WA-009,US-WA_3348,NA,,,"47.9003x-125.2623 - May 8, 2015, 12:25 PM",L3626726,P,47.900318,-125.262344,2015-05-08,12:25:00,obsr228041,S23333272,Traveling,P22,EBIRD,62,19.312,NA,15,1,G1262946,0,1,0,,"Holland America cruise <br />Submitted from BirdLog NA for iOS, version 1.8",May have been on ship for the entire trip,NA,TRUE,1,46,URN:CornellLabOfOrnithology:EBIRD:OBS322650346,20:06.0,1950,species,Eurasian Collared-Dove,Streptopelia decaocto,,,1,,,,Canada,CA,British Columbia,CA-BC,Skeena-Queen Charlotte,CA-BC-SQ,,NA,,,Princess Cruise 051415 1600,L3669925,P,51.845123,-132.341006,2015-05-14,16:00:00,obsr90300,S23617996,Traveling,P22,EBIRD,60,38.945,NA,7,1,,0,1,0,,from cruise ship; bearing 337 degrees from location lat/long; checklist following eBird pelagic protocol,,NA,TRUE,1,3,URN:CornellLabOfOrnithology:EBIRD:OBS323059294,39:28.0,1950,species,Eurasian Collared-Dove,Streptopelia decaocto,,,1,,,,Canada,CA,British Columbia,CA-BC,Central Coast,CA-BC-CC,,NA,,,Queen Charlotte Sound,L2357800,H,51.6111946,-129.4793701,2015-05-17,11:15:00,obsr450446,S23643692,Incidental,P20,EBIRD,NA,NA,NA,2,0,,0,1,0,,"Seen on the rear deck of the cruise ship ""Noordam""",,NA,TRUE,1,514,URN:CornellLabOfOrnithology:EBIRD:OBS326250514,06:55.0,1950,species,Eurasian Collared-Dove,Streptopelia decaocto,,,1,,,,United States,US,Oregon,US-OR,Curry,US-OR-015,,NA,,,Princess Cruise 052115 1100,L3713005,P,42.472395,-125.089229,2015-05-21,11:00:00,obsr90300,S23862136,Traveling,P22,EBIRD,90,65.016,NA,7,1,,0,1,0,,from cruise ship; bearing 180 degrees from start lat/long; following eBird pelagic protocol; encountered fleet of fishing trawlers during this transect; transect length modified from 60 min to 90 min to adjust for OR/CA state boundary; passerines observed on sun deck during quick lap.,,NA,TRUE,1,498,URN:CornellLabOfOrnithology:EBIRD:OBS397640584,37:24.0,1950,species,Eurasian Collared-Dove,Streptopelia decaocto,,,1,,,,United States,US,California,US-CA,Santa Barbara,US-CA-083,US-CA_4690,NA,,,"34.444x-120.888 - May 2, 2016 2:47 PM",L4557089,P,34.4440273,-120.8882672,2016-05-01,7:30:00,obsr296388,S29362793,eBird Pelagic Protocol,P60,EBIRD,30,10.461,NA,1,1,,0,1,0,,Birding from the Norwegian Pearl. <br />Submitted from eBird Android 1.0.4,Flew along the ship. Two seen later above the pool.,NA,TRUE,1,52,URN:CornellLabOfOrnithology:EBIRD:OBS398613749,06:59.0,1950,species,Eurasian Collared-Dove,Streptopelia decaocto,,,1,,,,United States,US,California,US-CA,Humboldt,US-CA-023,,NA,,,"40.636x-125.021 - May 5, 2016 12:03 PM",L4564988,P,40.6362777,-125.0207723,2016-05-03,6:00:00,obsr296388,S29422271,Traveling,P22,EBIRD,30,18.507,NA,1,1,,0,1,0,,Birding from the Norwegian Pearl.Â <br />Submitted from eBird Android 1.0.4,Riding the ship.,NA,TRUE,1,530,URN:CornellLabOfOrnithology:EBIRD:OBS407253279,48:45.0,1950,species,Eurasian Collared-Dove,Streptopelia decaocto,,,9,,,,United States,US,California,US-CA,Marin,US-CA-041,,NA,,,Offshore  California Hour 1 of 1,L4640570,P,37.77276,-122.63134,2016-05-11,18:30:00,obsr131591,S29911108,eBird Pelagic Protocol,P60,EBIRD,60,29.934,NA,2,1,G1799638,0,1,0,,"Princess Cruise round trip San Francisco to Alaska, day 1 northbound, Paul Lehman (with 9-person Wings tour group) and Bruce Rideout observers. Two BFAL seen much closer to shore than expected.",,NA,TRUE,1,51,URN:CornellLabOfOrnithology:EBIRD:OBS402231268,34:22.0,1950,species,Eurasian Collared-Dove,Streptopelia decaocto,,,3,,,,United States,US,California,US-CA,Del Norte,US-CA-015,,NA,,,"off Del Norte County, CA",L2885571,P,41.506,-125.515,2016-05-12,7:00:00,obsr50748,S29624364,Traveling,P22,EBIRD,20,8.047,NA,11,0,,0,1,0,,"1114-120 km WSW of Pt. St. George, from Grand Princess cruise ship",,NA,TRUE,1,49,URN:CornellLabOfOrnithology:EBIRD:OBS511951195,13:51.0,1950,species,Eurasian Collared-Dove,Streptopelia decaocto,,,2,,,,Canada,CA,British Columbia,CA-BC,Skeena-Queen Charlotte,CA-BC-SQ,,NA,,,Deep ocean,L5988163,P,51.467443,-136.3256121,2017-05-10,10:00:00,obsr230389,S37653434,Incidental,P20,EBIRD,NA,NA,NA,3,0,,0,1,0,,Cruise,,NA,TRUE,0,482,URN:CornellLabOfOrnithology:EBIRD:OBS505199393,03:35.0,1950,species,Eurasian Collared-Dove,Streptopelia decaocto,,,2,,,,United States,US,California,US-CA,San Mateo,US-CA-081,,NA,,,Offshore CA,L5893299,P,36.7783333,-122.9666667,2017-05-11,9:00:00,obsr193047,S37186556,Traveling,P22,EBIRD,60,35.727,NA,1,1,,0,1,0,,Princess cruise,Continuing birds flying with and landing on the ship,NA,TRUE,1,532,URN:CornellLabOfOrnithology:EBIRD:OBS510101428,47:38.0,1950,species,Eurasian Collared-Dove,Streptopelia decaocto,,,1,,,,United States,US,California,US-CA,Orange,US-CA-059,US-CA_4685,NA,,,Lausen Sea Mount,L5803436,H,33.3974106,-118.0006099,2017-06-10,8:30:00,obsr158843,S37519586,Traveling,P22,EBIRD,60,14.806,NA,46,1,G2485530,1,1,0,,"San Bernardino Valley Audubon pelagic trip out of Dana Point aboard the Ocean Institute's R/V Sea Explorer, with Mike Bursk as Captain and Tom Benson, Jon Feenstra, Matt Grube, Robert McNab, and Brad Singer as leaders. From Dana Point Harbor, we traveled west to Lausen Sea Mount, north-northwest to Platforms Eureka, Ellen, and Edith, east and south to San Gabriel Canyon, east toward Laguna Beach, and finally southeast along the 100-fathom curve back to Dana Point Harbor, with minor variations in course for birds and ocean conditions. Weather was mostly cloudy but becoming partly cloudy midday, with light to moderate winds, and temperatures in the 60s (F). This checklist covers the area from the halfway point between Dana Point and Lausen Sea Mount to the sea mount. ----<a href=""https://www.flickr.com/photos/40928097@N07/34484869073/in/dateposted-public/"" title=""Pelagic trip track - 10 Jun 2017""><img src=""https://c1.staticflickr.com/5/4278/34484869073_e106e2f848_z.jpg"" alt=""Pelagic trip track - 10 Jun 2017"" /></a>",A bird landed on the boat just as we were approaching Lausen Sea Mount.,NA,TRUE,1,521,URN:CornellLabOfOrnithology:EBIRD:OBS515368985,55:25.0,1950,species,Eurasian Collared-Dove,Streptopelia decaocto,,,1,,,,United States,US,Washington,US-WA,Clallam,US-WA-009,US-WA_3348,NA,,,Close to 12-Mile Bank,L6039993,P,48.0853899,-124.9926353,2017-06-30,7:00:00,obsr341334,S37903332,Incidental,P20,EBIRD,NA,NA,NA,3,0,,0,1,0,,Birds observed 12 miles off Cape Alava in area known as 12 mile bank.  It is on the edge of Juan de Fuca Canyon.  Birds observed from the vessel Windsong.  Birds observed while doing an experiment on halibut hooks.,,NA,TRUE,1,517,URN:CornellLabOfOrnithology:EBIRD:OBS533062317,04:22.0,1950,species,Eurasian Collared-Dove,Streptopelia decaocto,,,1,,,,United States,US,Oregon,US-OR,Curry,US-OR-015,,NA,,,offshore s. Oregon,L6271872,P,42.309,-126.004,2017-09-06,11:00:00,obsr50093,S39198111,Traveling,P22,EBIRD,21,6.437,NA,1,1,,1,1,0,,On Cruise Ship,Flew onto ship well out to sea,NA,TRUE,1,874,URN:CornellLabOfOrnithology:EBIRD:OBS606885405,21:11.0,1950,species,Eurasian Collared-Dove,Streptopelia decaocto,,,4,,,,United States,US,Washington,US-WA,Grays Harbor,US-WA-027,,NA,,,"North Pacific Ocean (47.0459,-125.2867)",L7289958,P,47.045864,-125.286742,2018-04-26,15:27:00,obsr19105,S44986573,eBird Pelagic Protocol,P60,EBIRD,15,9.302,NA,10,1,G3134681,0,1,0,,,,NA,TRUE,1,